{
  "schema_version": 1,
  "before": {
    "schema_version": 1,
    "vault_id": "vlt_00000001-0000-4000-8000-000000000001",
    "commit_id": "cmt_00000001-0000-4000-8000-000000000001",
    "sequence": 1,
    "manifest_sha256": "aaaaaaaaaaaaaaaaaaaaaaaaaaaaaaaaaaaaaaaaaaaaaaaaaaaaaaaaaaaaaaaa",
    "host_authority_hash": "89a2fb847d47786aebfcc6793a550559ec6f0d8190af20a1fa42723c149e34b9"
  },
  "after": {
    "schema_version": 1,
    "vault_id": "vlt_00000001-0000-4000-8000-000000000001",
    "commit_id": "cmt_00000001-0000-4000-8000-000000000001",
    "sequence": 1,
    "manifest_sha256": "aaaaaaaaaaaaaaaaaaaaaaaaaaaaaaaaaaaaaaaaaaaaaaaaaaaaaaaaaaaaaaaa",
    "host_authority_hash": "2882ecf48d5a59c73b7efbbe0f3a1d1e0cc820e9e88660aa7cbf008b91df6ee1"
  },
  "authority": {
    "schema_version": 1,
    "vault_id": "vlt_00000001-0000-4000-8000-000000000001",
    "revision": 3,
    "primary": {
      "host_id": "dev_00000002-0000-4000-8000-000000000001",
      "primary_epoch": 2
    },
    "checkpoint": {
      "commit_id": "cmt_00000001-0000-4000-8000-000000000001",
      "commit_sequence": 1,
      "snapshot_hash": "aaaaaaaaaaaaaaaaaaaaaaaaaaaaaaaaaaaaaaaaaaaaaaaaaaaaaaaaaaaaaaaa",
      "policy_epoch": 0,
      "deletion_epoch": 0
    },
    "phase": {
      "state": "active"
    },
    "promotions": [
      {
        "schema_version": 1,
        "intent": {
          "vault_id": "vlt_00000001-0000-4000-8000-000000000001",
          "operation_id": "op_00000001-0000-4000-8000-000000000001",
          "source": {
            "host_id": "dev_00000001-0000-4000-8000-000000000001",
            "primary_epoch": 1
          },
          "target_host": "dev_00000002-0000-4000-8000-000000000001",
          "base_revision": 1,
          "checkpoint": {
            "commit_id": "cmt_00000001-0000-4000-8000-000000000001",
            "commit_sequence": 1,
            "snapshot_hash": "aaaaaaaaaaaaaaaaaaaaaaaaaaaaaaaaaaaaaaaaaaaaaaaaaaaaaaaaaaaaaaaa",
            "policy_epoch": 0,
            "deletion_epoch": 0
          }
        },
        "plan_hash": "cd5f38f9ddf98a2d52ec3ff61e9aef76661c28358e40a542f7471d43724096c7"
      }
    ]
  }
}
